{
  "$schema": "../organisation.schema.json",
  "organisation": {
    "nom": "Clinique des Tilleuls (exemple)",
    "nomCourt": "Tilleuls",
    "secteur": "sante",
    "taille": "eti",
    "effectif": 650,
    "typeSI": "sur-site"
  },
  "contacts": {
    "securite": "rssi@tilleuls.example",
    "signalement": {
      "fr": "le numéro interne 4444 ou rssi@tilleuls.example",
      "en": "internal extension 4444 or rssi@tilleuls.example"
    },
    "telephoneUrgence": "01 23 45 67 89",
    "accessibilite": "handicap@tilleuls.example"
  },
  "charte": {
    "couleurPrimaire": "#4FB3A9",
    "couleurSecondaire": "#F2A541",
    "correctionContrasteAuto": true
  },
  "langues": {
    "defaut": "fr",
    "disponibles": [
      "fr"
    ]
  },
  "profilsActifs": [
    "utilisateur",
    "manager",
    "admin-it",
    "nouvel-arrivant"
  ],
  "risquesPrioritaires": [
    {
      "id": "rancongiciel",
      "priorite": 3,
      "justification": "Arrêt des soins en cas de chiffrement du SI (scénario n° 1 de l'analyse de risques)."
    },
    {
      "id": "fuite-donnees",
      "priorite": 3,
      "justification": "Données de santé : catégorie particulière au sens du RGPD."
    },
    {
      "id": "hameconnage",
      "priorite": 3
    },
    {
      "id": "ia-generative",
      "priorite": 2,
      "justification": "Usage d'assistants d'IA pour rédiger des comptes rendus médicaux."
    },
    {
      "id": "mots-de-passe",
      "priorite": 2
    },
    {
      "id": "privileges-admin",
      "priorite": 2
    }
  ],
  "reglementations": [
    "rgpd",
    "nis2",
    "hds",
    "pgssi-s"
  ],
  "modulesSectoriels": [
    "sante"
  ],
  "campagnes": {
    "debut": "2027-01-04",
    "onboardingDelaiJours": 7,
    "simulationPhishing": "mensuelle",
    "rappelModules": "semestrielle",
    "veilleNouvellesMenaces": "semestrielle",
    "exerciceCrise": "annuelle",
    "justifications": {
      "accueil": {
        "fr": "Forte rotation (intérimaires, internes, remplaçants de nuit) : le parcours d'accueil est obligatoire avant la remise des identifiants au dossier patient.",
        "en": "High turnover (agency staff, interns, night replacements): the induction path is compulsory before credentials for patient records are issued."
      },
      "simulation": {
        "fr": "Établissement de santé, cible prioritaire des rançongiciels : une simulation mensuelle très courte, adaptée aux équipes en horaires décalés.",
        "en": "Healthcare facility, a prime ransomware target: a very short monthly simulation, suited to staff working shifts."
      },
      "rappel": {
        "fr": "Les soignants disposent de peu de temps : rappels semestriels regroupés, complétés par les simulations mensuelles.",
        "en": "Care staff have little time: grouped six-monthly refreshers, backed up by the monthly simulations."
      },
      "veille": {
        "fr": "Le secteur santé est régulièrement visé par de nouvelles campagnes : revue des contenus tous les six mois, à partir des alertes du CERT Santé.",
        "en": "The health sector is regularly targeted by new campaigns: content review every six months, based on CERT Santé alerts."
      },
      "crise": {
        "fr": "Continuité des soins : exercice annuel de fonctionnement en mode dégradé avec la direction, la DSI et l'encadrement soignant.",
        "en": "Continuity of care: a yearly degraded-mode exercise with management, IT and senior nursing staff."
      },
      "bilan": {
        "fr": "Révision annuelle alignée sur la certification HAS et la politique de sécurité (PGSSI-S).",
        "en": "Yearly review aligned with HAS certification and the security policy (PGSSI-S)."
      }
    }
  },
  "evaluation": {
    "seuilReussite": 80,
    "delaiRetardJours": 21
  },
  "accessibilite": {
    "dateAudit": "2026-09-28",
    "etatConformite": "partiellement conforme"
  },
  "demo": {
    "graine": 42,
    "dateReference": "2027-06-15"
  }
}
